{
  "$schema": "https://json-schema.org/draft/2020-12/schema",
  "$id": "https://schemas.apas.example/ii/v4/input-snapshot.schema.json",
  "title": "Immutable Accepted Input Snapshot",
  "type": "object",
  "additionalProperties": false,
  "required": [
    "id",
    "tenant_id",
    "analysis_request_id",
    "boundary_resolution_id",
    "status",
    "canonical_hash",
    "created_at",
    "created_by",
    "inputs"
  ],
  "properties": {
    "id": {"type": "string", "pattern": "^snapshot_[a-z0-9_]+$"},
    "tenant_id": {"type": "string", "minLength": 3},
    "analysis_request_id": {"type": "string", "minLength": 3},
    "boundary_resolution_id": {"type": "string", "minLength": 3},
    "status": {"const": "frozen"},
    "canonical_hash": {"type": "string", "pattern": "^sha256:[a-f0-9]{64}$"},
    "created_at": {"type": "string", "format": "date-time"},
    "created_by": {"type": "string", "minLength": 3},
    "inputs": {
      "type": "array",
      "minItems": 1,
      "items": {
        "type": "object",
        "additionalProperties": false,
        "required": [
          "input_id",
          "quantity_type",
          "value",
          "unit",
          "time_basis",
          "boundary_id",
          "source_ref",
          "qualification_record_id"
        ],
        "properties": {
          "input_id": {"type": "string", "minLength": 3},
          "quantity_type": {"type": "string", "minLength": 1},
          "value": {"type": ["number", "string", "array", "object"]},
          "unit": {"type": "string", "minLength": 1},
          "time_basis": {
            "type": "object",
            "required": ["start", "end", "time_zone"],
            "properties": {
              "start": {"type": "string", "format": "date-time"},
              "end": {"type": "string", "format": "date-time"},
              "time_zone": {"type": "string", "minLength": 1}
            }
          },
          "boundary_id": {"type": "string", "minLength": 3},
          "source_ref": {
            "type": "object",
            "required": ["source_id", "raw_hash"],
            "properties": {
              "source_id": {"type": "string", "minLength": 3},
              "raw_hash": {"type": "string", "pattern": "^sha256:[a-f0-9]{64}$"}
            }
          },
          "qualification_record_id": {"type": "string", "minLength": 3},
          "warnings": {
            "type": "array",
            "items": {"type": "string"}
          }
        }
      }
    }
  }
}
